{
  "$schema": "https://json-schema.org/draft/2020-12/schema",
  "$id": "https://funimpute.com/schemas/imputation-metadata/v1.0.0",
  "title": "Enterprise Imputation Metadata Schema",
  "description": "Comprehensive metadata schema for enterprise-grade imputation analysis and governance",
  "type": "object",
  "required": ["schema_info", "columns"],
  "properties": {
    "schema_info": {
      "type": "object",
      "description": "Schema versioning and metadata information",
      "required": ["schema_version", "created_at", "owner"],
      "properties": {
        "schema_version": {
          "type": "string",
          "pattern": "^\\d+\\.\\d+\\.\\d+$",
          "description": "Semantic version of the metadata schema",
          "examples": ["1.0.0", "2.1.3"]
        },
        "metadata_version": {
          "type": "string",
          "pattern": "^\\d+\\.\\d+\\.\\d+$",
          "description": "Version of this specific metadata instance",
          "examples": ["1.0.0"]
        },
        "created_at": {
          "type": "string",
          "format": "date-time",
          "description": "ISO 8601 timestamp when metadata was created"
        },
        "updated_at": {
          "type": "string",
          "format": "date-time",
          "description": "ISO 8601 timestamp when metadata was last updated"
        },
        "owner": {
          "type": "string",
          "description": "Data owner responsible for this metadata",
          "examples": ["data-engineering@company.com", "john.doe@company.com"]
        },
        "steward": {
          "type": "string",
          "description": "Data steward responsible for data quality",
          "examples": ["jane.smith@company.com"]
        },
        "last_reviewed": {
          "type": "string",
          "format": "date",
          "description": "Date when metadata was last reviewed"
        },
        "reviewer_comments": {
          "type": "string",
          "description": "Comments from the last review"
        },
        "dataset_name": {
          "type": "string",
          "description": "Name of the dataset this metadata describes",
          "examples": ["material_master_data", "customer_transactions"]
        },
        "dataset_description": {
          "type": "string",
          "description": "Description of the dataset"
        }
      }
    },
    "lineage": {
      "type": "object",
      "description": "Data lineage and source information",
      "properties": {
        "source_system": {
          "type": "string",
          "description": "Source system or database",
          "examples": ["SAP_ERP", "Salesforce", "PostgreSQL_DWH"]
        },
        "source_table": {
          "type": "string",
          "description": "Source table or collection name",
          "examples": ["MARA", "Account", "dim_customer"]
        },
        "extraction_method": {
          "type": "string",
          "enum": ["full_load", "incremental", "cdc", "api", "manual"],
          "description": "Method used to extract data"
        },
        "transformation_notes": {
          "type": "string",
          "description": "Notes about transformations applied to the data"
        },
        "data_classification": {
          "type": "string",
          "enum": ["public", "internal", "confidential", "restricted"],
          "description": "Data classification level"
        }
      }
    },
    "quality_thresholds": {
      "type": "object",
      "description": "Global quality thresholds for alerting",
      "properties": {
        "max_missing_percentage": {
          "type": "number",
          "minimum": 0,
          "maximum": 1,
          "description": "Maximum acceptable missing percentage (0-1) before triggering alerts",
          "default": 0.2
        },
        "max_outlier_percentage": {
          "type": "number",
          "minimum": 0,
          "maximum": 1,
          "description": "Maximum acceptable outlier percentage (0-1) before triggering alerts",
          "default": 0.1
        },
        "min_data_freshness_hours": {
          "type": "integer",
          "minimum": 1,
          "description": "Minimum data freshness in hours",
          "default": 24
        }
      }
    },
    "columns": {
      "type": "array",
      "description": "Array of column metadata definitions",
      "minItems": 1,
      "items": {
        "$ref": "#/$defs/column_metadata"
      }
    }
  },
  "$defs": {
    "column_metadata": {
      "type": "object",
      "description": "Comprehensive metadata for a single column",
      "required": ["name", "data_type", "required", "unique"],
      "properties": {
        "name": {
          "type": "string",
          "pattern": "^[a-zA-Z][a-zA-Z0-9_]*$",
          "description": "Column name (must start with letter, alphanumeric and underscore only)",
          "examples": ["Material_ID", "Unit_Price", "created_at"]
        },
        "display_name": {
          "type": "string",
          "description": "Human-readable display name",
          "examples": ["Material ID", "Unit Price", "Created At"]
        },
        "description": {
          "type": "string",
          "description": "Detailed description of the column",
          "examples": ["Unique identifier for materials in the system"]
        },
        "data_type": {
          "type": "string",
          "enum": ["integer", "float", "string", "datetime", "boolean", "categorical"],
          "description": "Primary data type of the column"
        },
        "required": {
          "type": "boolean",
          "description": "Whether this column is required (cannot be null in business logic)"
        },
        "unique": {
          "type": "boolean",
          "description": "Whether this column contains unique values (primary key, unique identifier)"
        },
        "constraints": {
          "type": "object",
          "description": "Value constraints and validation rules",
          "properties": {
            "min_value": {
              "type": "number",
              "description": "Minimum allowed numeric value"
            },
            "max_value": {
              "type": "number",
              "description": "Maximum allowed numeric value"
            },
            "min_length": {
              "type": "integer",
              "minimum": 0,
              "description": "Minimum string length"
            },
            "max_length": {
              "type": "integer",
              "minimum": 1,
              "description": "Maximum string length"
            },
            "allowed_values": {
              "type": "array",
              "description": "List of allowed categorical values",
              "items": {
                "type": ["string", "number", "boolean"]
              },
              "examples": [["A", "B", "C"], [1, 2, 3, 4, 5]]
            },
            "pattern": {
              "type": "string",
              "format": "regex",
              "description": "Regular expression pattern for string validation",
              "examples": ["^[A-Z]{2,3}-\\d{4}$", "^\\d{3}-\\d{2}-\\d{4}$"]
            },
            "format": {
              "type": "string",
              "enum": ["email", "url", "uuid", "date", "time", "datetime", "currency"],
              "description": "Specific format for string validation"
            }
          }
        },
        "imputation_config": {
          "type": "object",
          "description": "Imputation-specific configuration",
          "properties": {
            "missing_strategy_hint": {
              "type": "string",
              "enum": ["MCAR", "MAR", "MNAR", "custom"],
              "description": "Hint about expected missingness mechanism"
            },
            "default_imputer": {
              "type": "string",
              "enum": ["mean", "median", "mode", "regression", "knn", "business_rule", "manual", "forward_fill", "backward_fill", "constant"],
              "description": "Preferred imputation method"
            },
            "imputer_parameters": {
              "type": "object",
              "description": "Parameters for the chosen imputer",
              "properties": {
                "n_neighbors": {
                  "type": "integer",
                  "minimum": 1,
                  "description": "Number of neighbors for kNN imputation"
                },
                "constant_value": {
                  "type": ["string", "number", "boolean"],
                  "description": "Constant value for constant imputation"
                },
                "regression_features": {
                  "type": "array",
                  "items": {"type": "string"},
                  "description": "Features to use for regression imputation"
                }
              }
            },
            "quality_thresholds": {
              "type": "object",
              "description": "Column-specific quality thresholds",
              "properties": {
                "max_missing_pct": {
                  "type": "number",
                  "minimum": 0,
                  "maximum": 1,
                  "description": "Maximum acceptable missing percentage for this column"
                },
                "max_outlier_pct": {
                  "type": "number",
                  "minimum": 0,
                  "maximum": 1,
                  "description": "Maximum acceptable outlier percentage for this column"
                }
              }
            }
          }
        },
        "relationships": {
          "type": "object",
          "description": "Relationships with other columns",
          "properties": {
            "dependent_columns": {
              "type": "array",
              "items": {"type": "string"},
              "description": "Columns that this column depends on",
              "examples": [["Safety_Stock"], ["Category", "Supplier_Rating"]]
            },
            "influences_columns": {
              "type": "array",
              "items": {"type": "string"},
              "description": "Columns that are influenced by this column"
            },
            "foreign_keys": {
              "type": "array",
              "items": {
                "type": "object",
                "properties": {
                  "table": {"type": "string"},
                  "column": {"type": "string"}
                }
              },
              "description": "Foreign key relationships"
            }
          }
        },
        "business_rules": {
          "type": "array",
          "description": "Business rules and constraints",
          "items": {
            "type": "object",
            "required": ["rule_id", "expression", "description"],
            "properties": {
              "rule_id": {
                "type": "string",
                "description": "Unique identifier for the business rule"
              },
              "expression": {
                "type": "string",
                "description": "Business rule expression",
                "examples": ["Current_Stock <= Safety_Stock * 1.2", "Unit_Price > 0", "Category IN ['A', 'B', 'C']"]
              },
              "description": {
                "type": "string",
                "description": "Human-readable description of the rule"
              },
              "severity": {
                "type": "string",
                "enum": ["error", "warning", "info"],
                "description": "Severity level when rule is violated",
                "default": "warning"
              },
              "active": {
                "type": "boolean",
                "description": "Whether this rule is currently active",
                "default": true
              }
            }
          }
        },
        "lineage": {
          "type": "object",
          "description": "Column-specific lineage information",
          "properties": {
            "source_column": {
              "type": "string",
              "description": "Original source column name"
            },
            "transformations": {
              "type": "array",
              "items": {
                "type": "object",
                "properties": {
                  "type": {"type": "string"},
                  "description": {"type": "string"},
                  "applied_at": {"type": "string", "format": "date-time"}
                }
              },
              "description": "Transformations applied to this column"
            }
          }
        },
        "governance": {
          "type": "object",
          "description": "Governance and compliance information",
          "properties": {
            "pii": {
              "type": "boolean",
              "description": "Whether column contains personally identifiable information",
              "default": false
            },
            "sensitive": {
              "type": "boolean",
              "description": "Whether column contains sensitive business data",
              "default": false
            },
            "retention_policy": {
              "type": "string",
              "description": "Data retention policy for this column",
              "examples": ["7_years", "indefinite", "30_days"]
            },
            "compliance_tags": {
              "type": "array",
              "items": {"type": "string"},
              "description": "Compliance frameworks this column relates to",
              "examples": [["GDPR", "SOX"], ["HIPAA"], ["PCI_DSS"]]
            }
          }
        },
        "statistics": {
          "type": "object",
          "description": "Statistical metadata (can be auto-generated)",
          "properties": {
            "last_profiled": {
              "type": "string",
              "format": "date-time",
              "description": "When column was last profiled"
            },
            "distinct_count": {
              "type": "integer",
              "minimum": 0,
              "description": "Number of distinct values"
            },
            "null_count": {
              "type": "integer",
              "minimum": 0,
              "description": "Number of null values"
            },
            "null_percentage": {
              "type": "number",
              "minimum": 0,
              "maximum": 1,
              "description": "Percentage of null values"
            },
            "mean": {
              "type": "number",
              "description": "Mean value (for numeric columns)"
            },
            "median": {
              "type": "number",
              "description": "Median value (for numeric columns)"
            },
            "std_dev": {
              "type": "number",
              "minimum": 0,
              "description": "Standard deviation (for numeric columns)"
            },
            "min": {
              "type": "number",
              "description": "Minimum value (for numeric columns)"
            },
            "max": {
              "type": "number",
              "description": "Maximum value (for numeric columns)"
            },
            "top_values": {
              "type": "array",
              "items": {
                "type": "object",
                "properties": {
                  "value": {"type": ["string", "number", "boolean"]},
                  "count": {"type": "integer"},
                  "percentage": {"type": "number"}
                }
              },
              "description": "Most frequent values and their counts"
            }
          }
        },
        "version": {
          "type": "string",
          "pattern": "^\\d+\\.\\d+\\.\\d+$",
          "description": "Version of this column metadata",
          "default": "1.0.0"
        },
        "tags": {
          "type": "array",
          "items": {"type": "string"},
          "description": "Custom tags for categorization",
          "examples": [["financial", "core"], ["derived", "calculated"]]
        }
      }
    }
  }
}
